chinese_word,french_translation,chinese_sentence,french_sentence
阿姨,tante,这是我的阿姨。,C'est ma tante.
啊,ah,我明白了啊！,"Ah, je comprends !"
矮,petit,这棵树很矮。,Cet arbre est petit.
安静,calme,请保持安静。,Veuillez rester calme.
八,huit,我有八本书。,J'ai huit livres.
把,prendre,把书放在桌子上。,Mets le livre sur la table.
爸爸,papa,我爸爸在工作。,Mon papa travaille.
吧,d'accord,我们去吃饭吧。,"Allons manger, d'accord ?"
白,blanc,这朵花是白色的。,Cette fleur est blanche.
百,cent,这本书有一百页。,Ce livre a cent pages.
班,classe,我在三年级二班。,Je suis dans la classe 2 en troisième année.
搬,déménager,我们明天要搬家。,Nous déménageons demain.
半,demi,现在是八点半。,Il est huit heures et demie.
帮忙,aider,你能帮忙吗？,Peux-tu m'aider ?
帮助,assistance,谢谢你的帮助。,Merci pour ton assistance.
包,emballer/couvrir,请把礼物包起来。,"S'il te plaît, emballe le cadeau."
杯子,verre/tasse,这个杯子很漂亮。,Cette tasse est très jolie.
北方,nord,我来自中国北方。,Je viens du nord de la Chine.
北京,Pékin,北京是中国的首都。,Pékin est la capitale de la Chine.
被,être/par,他被老师表扬了。,Il a été félicité par le professeur.
本,livre/origine,这本书很有意思。,Ce livre est très intéressant.
鼻子,nez,她的鼻子很小。,Son nez est petit.
比,plus que,他比我高。,Il est plus grand que moi.
表示,exprimer,我想表示感谢。,Je voudrais exprimer ma gratitude.
表演,spectacle/jouer,她要去表演唱歌。,Elle va faire un spectacle de chant.
别,ne pas,别说话！,Ne parle pas !
别人,les autres,别人都已经走了。,Les autres sont déjà partis.
冰箱,réfrigérateur,冰箱里有牛奶。,Il y a du lait dans le réfrigérateur.
不客气,de rien,谢谢！-不客气。,Merci ! - De rien.
不,ne pas,我不喜欢咖啡。,Je n'aime pas le café.
才,talent/seulement,他很有音乐才华,Il a beaucoup de talent pour la musique
菜,plat/légume,这道菜很好吃,Ce plat est délicieux
参加,participer,我要参加这个比赛,Je vais participer à cette compétition
草,herbe,草地上有很多花,Il y a beaucoup de fleurs dans l'herbe
茶,thé,我每天早上喝茶,Je bois du thé tous les matins
差,différent/mauvais,他的成绩很差,Ses résultats sont mauvais
唱歌,chanter,她喜欢唱歌,Elle aime chanter
超市,supermarché,我去超市买东西,Je vais faire des courses au supermarché
城市,ville,北京是一个大城市,Pékin est une grande ville
吃,manger,我们一起吃午饭,Nous mangeons ensemble le déjeuner
出,sortir,他刚出门,Il vient de sortir
厨房,cuisine,妈妈在厨房做饭,Maman fait la cuisine dans la cuisine
除了,sauf/excepté,除了他都来了,Tout le monde est venu sauf lui
船,bateau,那艘船很大,Ce bateau est très grand
春,printemps,春天来了,Le printemps est arrivé
次,fois,这是我第二次来巴黎。,C'est ma deuxième fois à Paris.
从,de; depuis,他从北京来。,Il vient de Pékin.
打算,avoir l'intention de,我打算明天去购物。,J'ai l'intention d'aller faire des courses demain.
大,grand,这是一个大房子。,C'est une grande maison.
大家,tout le monde,大家都喜欢这个老师。,Tout le monde aime ce professeur.
担心,s'inquiéter,妈妈担心我的健康。,Ma mère s'inquiète pour ma santé.
蛋糕,gâteau,这个蛋糕很好吃。,Ce gâteau est délicieux.
但是,mais,我想去，但是没有时间。,"Je veux y aller, mais je n'ai pas le temps."
当然,bien sûr,当然，我会帮你。,"Bien sûr, je vais t'aider."
到,arriver à,我们到学校了。,Nous sommes arrivés à l'école.
地,particule adverbiale,她快乐地唱歌。,Elle chante joyeusement.
的,de,这是我的书。,C'est mon livre.
得,particule de degré,他跑得很快。,Il court très vite.
灯,lampe,请打开灯。,"Allume la lampe, s'il te plaît."
等,attendre,我在等公交车。,J'attends le bus.
低,bas/basse,他的声音很低,Sa voix est très basse
弟弟,petit frère,我的弟弟今年十岁,Mon petit frère a dix ans cette année
地方,endroit/lieu,这个地方很安静,Cet endroit est très calme
第一,premier/première,他是班上第一名,Il est premier de la classe
点,point/heure,现在八点了,Il est huit heures maintenant
冬,hiver,北京的冬天很冷,L'hiver à Pékin est très froid
懂,comprendre,我懂你的意思,Je comprends ce que tu veux dire
都,tout/tous,我们都喜欢吃水果,Nous aimons tous manger des fruits
短,court/courte,她的头发很短,Ses cheveux sont très courts
段,section/partie,这段话很重要,Cette section est très importante
多,beaucoup/nombreux,这里有很多人,Il y a beaucoup de gens ici
多么,combien/comme,今天天气多么好啊,Comme le temps est beau aujourd'hui
多少,combien,这个苹果多少钱,Combien coûte cette pomme
而且,et aussi/de plus,她很聪明而且很用功,Elle est intelligente et aussi travailleuse
儿子,fils,我的儿子在上学,Mon fils est à l'école
耳朵,oreille,我的耳朵疼。,Mes oreilles me font mal.
二,deux,我是第二名。,Je suis deuxième.
方便,pratique,这个地方很方便。,Cet endroit est très pratique.
放,mettre,请把书放在桌子上。,Mets le livre sur la table s'il te plaît.
放心,être rassuré,你放心吧，我会准时到。,"Sois tranquille, j'arriverai à l'heure."
非常,très,今天天气非常好。,Le temps est très beau aujourd'hui.
分,diviser,请把蛋糕分成四份。,Divise le gâteau en quatre parts.
附近,près de,超市就在附近。,Le supermarché est tout près.
敢,oser,我不敢一个人去。,Je n'ose pas y aller seul.
感冒,rhume,我昨天感冒了。,J'ai attrapé un rhume hier.
高,haut,这座山很高。,Cette montagne est très haute.
高兴,content,我今天很高兴。,Je suis très content aujourd'hui.
哥哥,grand frère,我哥哥在北京工作。,Mon grand frère travaille à Pékin.
个,classificateur,我买了三个苹果。,J'ai acheté trois pommes.
跟,avec,我想跟你一起去。,Je veux aller avec toi.
根据,selon,根据天气预报，明天会下雨。,"Selon les prévisions météo, il va pleuvoir demain."
更,encore plus,这件衣服更漂亮。,Ce vêtement est encore plus beau.
公斤,kilogramme,我买了两公斤苹果。,J'ai acheté deux kilogrammes de pommes.
公司,entreprise,他在一家大公司工作。,Il travaille dans une grande entreprise.
公园,parc,周末我喜欢去公园散步。,J'aime me promener dans le parc le weekend.
工作,travail,她找到了新工作。,Elle a trouvé un nouveau travail.
故事,histoire,妈妈给我讲了一个故事。,Maman m'a raconté une histoire.
关,fermer,请关门。,Fermez la porte s'il vous plaît.
关系,relation,他们的关系很好。,Ils ont une bonne relation.
关心,se soucier,父母很关心我的健康。,Mes parents se soucient beaucoup de ma santé.
关于,à propos de,这本书是关于中国历史的。,Ce livre est à propos de l'histoire chinoise.
国家,pays,中国是一个大国家。,La Chine est un grand pays.
果汁,jus de fruit,我想喝杯果汁。,Je voudrais un verre de jus de fruit.
孩子,enfant,这个孩子很可爱。,Cet enfant est très mignon.
害怕,avoir peur,我害怕黑暗。,J'ai peur du noir.
好,bon/bien,这个电影很好看,Ce film est très bon
好吃,délicieux,这家餐厅的菜很好吃,La nourriture dans ce restaurant est délicieuse
号,numéro/jour,今天是三号,Aujourd'hui c'est le trois du mois
喝,boire,我想喝水,Je veux boire de l'eau
和,et,我和我的朋友去商店,Mon ami et moi allons au magasin
河,rivière,这条河很长,Cette rivière est très longue
黑,noir,天空变黑了,Le ciel est devenu noir
黑板,tableau noir,老师在黑板上写字,Le professeur écrit sur le tableau noir
很,très,今天很热,Il fait très chaud aujourd'hui
后面,derrière,书包在椅子后面,Le sac est derrière la chaise
花,fleur,她喜欢红花,Elle aime les fleurs rouges
花园,jardin,我家有一个漂亮的花园,J'ai un beau jardin chez moi
画,dessiner/tableau,他会画画,Il sait dessiner
坏,mauvais/cassé,这个手机坏了,Ce téléphone est cassé
黄,jaune,我喜欢黄色的衣服,J'aime les vêtements jaunes
回,retourner,他明天回家。,Il rentre chez lui demain.
回答,répondre,请回答这个问题。,Veuillez répondre à cette question.
会,pouvoir/savoir,我会说法语。,Je sais parler français.
或者,ou,你想喝茶或者咖啡？,Tu veux du thé ou du café ?
几乎,presque,我几乎每天都运动。,Je fais presque du sport tous les jours.
机会,opportunité,这是一个好机会。,C'est une bonne opportunité.
极,extrêmement,这个餐厅极好。,Ce restaurant est extrêmement bon.
几,combien/quelques,你有几本书？,Combien de livres as-tu ?
家,maison/famille,我的家在北京。,Ma maison est à Pékin.
件,pièce/article,我买了三件衣服。,J'ai acheté trois vêtements.
健康,santé/sain,健康很重要。,La santé est importante.
教,enseigner,她教中文。,Elle enseigne le chinois.
脚,pied,我的脚很疼。,Mon pied me fait mal.
角,coin/angle,书在角落里。,Le livre est dans le coin.
叫,appeler,我叫Marie。,Je m'appelle Marie.
教室,salle de classe,我们的教室很大很亮。,Notre salle de classe est grande et lumineuse.
接,recevoir,请接一下电话。,"S'il te plaît, réponds au téléphone."
街道,rue,这条街道很安静。,Cette rue est très calme.
姐姐,grande sœur,我的姐姐在法国工作。,Ma grande sœur travaille en France.
解决,résoudre,我们需要解决这个问题。,Nous devons résoudre ce problème.
借,emprunter,我想借一本书。,Je voudrais emprunter un livre.
今天,aujourd'hui,今天天气很好。,Il fait beau aujourd'hui.
近,proche,我家离学校很近。,Ma maison est proche de l'école.
九,neuf,现在是九点钟。,Il est neuf heures.
久,longtemps,我们很久没见面了。,Cela fait longtemps qu'on ne s'est pas vus.
旧,vieux,这是一件旧衣服。,C'est un vieux vêtement.
就,juste,我就要到了。,Je vais arriver tout de suite.
句子,phrase,这个句子很简单。,Cette phrase est très simple.
决定,décider,我决定学习法语。,J'ai décidé d'apprendre le français.
咖啡,café,我每天早上喝咖啡。,Je bois du café tous les matins.
开,ouvrir,请帮我开门。,"S'il vous plaît, ouvrez-moi la porte."
开始,commencer,电影要开始了。,Le film va commencer.
看,regarder/voir,我喜欢看书。,J'aime lire des livres.
渴,avoir soif,我很渴想喝水。,"J'ai soif, je veux boire de l'eau."
可能,possible/peut-être,明天可能会下雨。,Il va peut-être pleuvoir demain.
可以,pouvoir,我可以帮你吗？,Est-ce que je peux vous aider ?
刻,quart d'heure,现在是三点一刻。,Il est trois heures et quart.
客人,invité/client,我家有客人来。,Nous avons des invités à la maison.
口,bouche,这个家有三口人。,Cette famille compte trois personnes.
哭,pleurer,孩子为什么在哭？,Pourquoi l'enfant pleure-t-il ?
快,rapide/vite,请快点儿走。,"Marchez plus vite, s'il vous plaît."
筷子,baguettes,请给我一双筷子。,"Donnez-moi une paire de baguettes, s'il vous plaît."
来,venir,他明天来北京。,Il vient à Pékin demain.
老,vieux/ancien,这是我的老师。,C'est mon professeur.
了,particule,我吃了早饭。,J'ai pris mon petit-déjeuner.
累,fatigué,我今天很累因为工作太多,Je suis fatigué aujourd'hui car j'ai trop travaillé
冷,froid,今天外面很冷,Il fait froid dehors aujourd'hui
离,quitter,他离家去上学,Il quitte la maison pour aller à l'école
离开,partir,她明天要离开北京,Elle va partir de Pékin demain
里,dans/intérieur,钱包在包里,Le portefeuille est dans le sac
礼物,cadeau,这是给你的生日礼物,C'est un cadeau d'anniversaire pour toi
两,deux,我有两本书,J'ai deux livres
了解,comprendre,我完全了解这个问题,Je comprends complètement ce problème
零,zéro,现在是零度,Il fait zéro degré maintenant
六,six,我有六个苹果,J'ai six pommes
楼,immeuble,我住在三楼,J'habite au troisième étage
路,route,这条路通向公园,Cette route mène au parc
旅游,voyager,我喜欢去中国旅游,J'aime voyager en Chine
慢,lent,请说慢一点,Parlez plus lentement s'il vous plaît
忙,occupé,我今天很忙,Je suis très occupé aujourd'hui
猫,chat,我家有一只黑猫。,J'ai un chat noir chez moi.
帽子,chapeau,这顶红帽子很漂亮。,Ce chapeau rouge est très joli.
没,ne...pas,我没吃早饭。,Je n'ai pas pris le petit-déjeuner.
没关系,ce n'est pas grave,你迟到了没关系。,Ce n'est pas grave que tu sois en retard.
每,chaque,每天我都喝咖啡。,Je bois du café chaque jour.
妹妹,petite sœur,我妹妹今年十岁。,Ma petite sœur a dix ans.
门,porte,请关上门。,Ferme la porte s'il te plaît.
米,riz,我要买一袋米。,Je veux acheter un sac de riz.
面包,pain,早餐我喜欢吃面包。,J'aime manger du pain au petit-déjeuner.
面条,nouilles,这些面条很好吃。,Ces nouilles sont délicieuses.
明白,comprendre,我明白你的意思。,Je comprends ce que tu veux dire.
明天,demain,明天我们去公园。,Demain nous allons au parc.
名字,nom,你的名字是什么？,Quel est ton nom?
拿,prendre,请拿一个杯子。,Prends un verre s'il te plaît.
哪,quel/quelle,你住在哪个城市？,Dans quelle ville habites-tu?
哪儿,où,你的书在哪儿？,Où est ton livre?
那,"ce, cela, ça",我要那本书。,Je veux ce livre-là.
那儿,là-bas,我的车在那儿。,Ma voiture est là-bas.
奶奶,grand-mère,我的奶奶住在北京。,Ma grand-mère habite à Pékin.
南,sud,他家在南方。,Sa maison est dans le sud.
男人,homme,那个男人是我的老师。,Cet homme est mon professeur.
呢,et,你好，你呢？,"Bonjour, et toi?"
能,pouvoir,我能说法语。,Je peux parler français.
你,tu,你住在哪里？,Où habites-tu?
年,année,今年是2024年。,Cette année est 2024.
您,vous,您好，老师。,"Bonjour, professeur."
牛奶,lait,我每天喝牛奶。,Je bois du lait tous les jours.
努力,s'efforcer,我要努力学习。,Je dois étudier avec effort.
女儿,fille,她的女儿很可爱。,Sa fille est très mignonne.
女人,femme,那个女人是医生。,Cette femme est médecin.
爬山,faire de la randonnée,周末我喜欢和朋友一起爬山,Le weekend j'aime faire de la randonnée avec mes amis
胖,gros,我的猫最近变得很胖,Mon chat est devenu très gros récemment
跑步,courir,每天早上我都去公园跑步,Je vais courir au parc tous les matins
朋友,ami,她是我最好的朋友,Elle est ma meilleure amie
啤酒,bière,他喜欢喝冰啤酒,Il aime boire de la bière fraîche
便宜,pas cher,这件衣服很便宜,Ce vêtement est très bon marché
票,billet,我买了两张电影票,J'ai acheté deux billets de cinéma
漂亮,beau/belle,这朵花真漂亮,Cette fleur est très belle
苹果,pomme,我每天吃一个苹果,Je mange une pomme par jour
葡萄,raisin,我很喜欢吃葡萄,J'aime beaucoup manger des raisins
七,sept,我有七本书,J'ai sept livres
妻子,épouse,他的妻子是老师,Son épouse est professeur
其他,autre,其他人都回家了,Les autres sont rentrés chez eux
起床,se lever,我每天七点起床,Je me lève à sept heures tous les jours
千,mille,这本书卖一千元,Ce livre coûte mille yuans
前面,devant,请在前面等我。,Attendez-moi devant.
清楚,clair,我现在明白得很清楚。,Je comprends très clairement maintenant.
晴,ensoleillé,今天天气很晴。,Il fait beau aujourd'hui.
秋,automne,秋天是我最喜欢的季节。,L'automne est ma saison préférée.
去,aller,我要去超市买东西。,Je vais au supermarché faire des courses.
奇怪,étrange,这个声音很奇怪。,Ce bruit est étrange.
去年,l'année dernière,去年我去了法国。,"L'année dernière, je suis allé en France."
裙子,jupe,这条裙子很漂亮。,Cette jupe est très jolie.
然后,ensuite,我先吃饭，然后去工作。,"Je mange d'abord, ensuite je vais travailler."
人,personne,这个房间里有三个人。,Il y a trois personnes dans cette pièce.
日,jour,今日天气很好。,Le temps est beau aujourd'hui.
容易,facile,这个题目很容易。,Cet exercice est facile.
如果,si,如果下雨我就不去。,"Si il pleut, je n'irai pas."
三,trois,我有三本书。,J'ai trois livres.
商店,magasin,这个商店九点开门。,Ce magasin ouvre à neuf heures.
上,sur,书在桌子上,Le livre est sur la table
上班,aller au travail,我每天早上八点上班,Je vais au travail tous les jours à huit heures
上网,se connecter à Internet,我喜欢在家上网,J'aime me connecter à Internet à la maison
上午,matin,上午我去买菜,"Le matin, je vais faire les courses"
少,peu,这里的人很少,Il y a peu de gens ici
身体,corps,要注意保护身体,Il faut prendre soin de son corps
什么,quoi,你想吃什么？,Que veux-tu manger ?
生病,tomber malade,他昨天生病了,Il est tombé malade hier
生气,être en colère,请不要生气,"S'il te plaît, ne sois pas en colère"
生日,anniversaire,今天是我的生日,Aujourd'hui c'est mon anniversaire
声音,voix,这个声音很好听,Cette voix est très belle
十,dix,我有十本书,J'ai dix livres
使,faire,这使我很开心,Cela me rend heureux
是,être,他是老师,Il est professeur
世界,monde,这是一个美丽的世界,C'est un beau monde
事情,affaire,这件事情很重要,Cette affaire est très importante
手表,montre,我的手表坏了,Ma montre est cassée
手机,téléphone portable,我忘记带手机了,J'ai oublié mon téléphone portable
瘦,mince,她变得很瘦,Elle est devenue très mince
舒服,confortable,这张椅子很舒服,Cette chaise est très confortable
叔叔,oncle,我的叔叔住在巴黎,Mon oncle habite à Paris
数学,mathématiques,我喜欢学数学,J'aime étudier les mathématiques
双,paire,我买了一双新鞋,J'ai acheté une paire de nouvelles chaussures
水,eau,我每天喝很多水,Je bois beaucoup d'eau chaque jour
水果,fruit,她爱吃水果,Elle aime manger des fruits
水平,niveau,他的法语水平很高,Son niveau de français est élevé
司机,chauffeur,这个司机开车很好,Ce chauffeur conduit très bien
四,quatre,我有四本书,J'ai quatre livres
送,offrir,我想送你一个礼物,Je veux t'offrir un cadeau
虽然,bien que,虽然下雨了我们还是去了,"Bien qu'il pleuvait, nous y sommes allés"
所以,donc,因为下雨了，所以我们不能去公园。,"Comme il pleut, donc nous ne pouvons pas aller au parc."
他,il,他是我的好朋友。,Il est mon bon ami.
她,elle,她喜欢读书。,Elle aime lire des livres.
它,il/elle (pour objets),它是一只可爱的猫。,C'est un chat mignon.
太,trop,这个房间太小了。,Cette pièce est trop petite.
太阳,soleil,今天太阳很大。,Le soleil est fort aujourd'hui.
糖,sucre,我不喜欢吃太多糖。,Je n'aime pas manger trop de sucre.
特别,spécial/particulièrement,这个餐厅特别好吃。,Ce restaurant est particulièrement bon.
踢足球,jouer au football,我们周末喜欢踢足球。,Nous aimons jouer au football le weekend.
提高,améliorer,我想提高我的法语水平。,Je veux améliorer mon niveau de français.
体育,sport,他很喜欢体育运动。,Il aime beaucoup le sport.
天气,temps (météo),今天天气很好。,Il fait beau aujourd'hui.
甜,sucré,这个蛋糕很甜。,Ce gâteau est très sucré.
条,pièce/morceau,我买了一条新裤子。,J'ai acheté un nouveau pantalon.
跳舞,danser,她很会跳舞。,Elle danse très bien.
听,écouter,我喜欢听音乐,J'aime écouter de la musique
同事,collègue,这是我的新同事,C'est mon nouveau collègue
同学,camarade de classe,他是我的老同学,C'est mon ancien camarade de classe
同意,être d'accord,我同意你的想法,Je suis d'accord avec ton idée
突然,soudain,他突然来了,Il est venu soudainement
外,extérieur,外面下雨了,Il pleut dehors
完,finir,电影看完了,Le film est terminé
完成,accomplir,我完成了作业,J'ai terminé mes devoirs
玩,jouer,孩子们在公园玩,Les enfants jouent dans le parc
碗,bol,这个碗很漂亮,Ce bol est très joli
晚上,soir,晚上我们去吃饭,Nous allons dîner ce soir
万,dix mille,这本书卖了一万本,Ce livre s'est vendu à dix mille exemplaires
喂,allô,喂，你好吗？,"Allô, comment vas-tu ?"
位,personne (classificateur),这位是我的老师,Cette personne est mon professeur
文化,culture,中国文化很有趣,La culture chinoise est très intéressante
我,je/moi,我是学生,Je suis étudiant
五,cinq,我有五本书,J'ai cinq livres
西,ouest,太阳从西边落下,Le soleil se couche à l'ouest
西瓜,pastèque,夏天我喜欢吃西瓜,"En été, j'aime manger de la pastèque"
希望,espérer/espoir,我希望明天是晴天,J'espère qu'il fera beau demain
洗,laver,我要洗衣服,Je vais laver les vêtements
洗澡,se doucher,晚上我要洗澡,Je vais prendre une douche ce soir
下,bas/descendre,请往下看,Regardez en bas s'il vous plaît
下午,après-midi,下午我去买东西,Je vais faire des courses cet après-midi
下雨,pleuvoir,今天下雨了,Il pleut aujourd'hui
夏,été,夏天很热,L'été fait très chaud
先,d'abord,请你先坐,Asseyez-vous d'abord
先生,monsieur,王先生是老师,Monsieur Wang est professeur
香蕉,banane,我想买香蕉,Je veux acheter des bananes
相同,identique,这两本书是相同的,Ces deux livres sont identiques
相信,croire,我相信你会成功的,Je crois que tu vas réussir
想,penser/vouloir,我想去法国旅游,Je veux voyager en France
向,vers,他向学校走去,Il marche vers l'école
像,ressembler à,她很像她的妈妈,Elle ressemble beaucoup à sa mère
小,petit,这是一个小房间,C'est une petite chambre
小姐,mademoiselle,王小姐是我的老师,Mademoiselle Wang est mon professeur
小心,faire attention,过马路要小心,Il faut faire attention en traversant la rue
笑,rire/sourire,她总是在笑,Elle sourit toujours
些,quelques,我买了些水果,J'ai acheté quelques fruits
鞋,chaussures,这双鞋很舒服,Ces chaussures sont très confortables
写,écrire,我在写一封信,J'écris une lettre
新,nouveau,这是一本新书,C'est un nouveau livre
信,lettre,我收到一封信,J'ai reçu une lettre
星期,semaine,下星期我去北京,"La semaine prochaine, je vais à Pékin"
行李箱,valise,我的行李箱很重,Ma valise est très lourde
姓,nom de famille,你姓什么？,Quel est ton nom de famille?
兴趣,intérêt,我对音乐很有兴趣。,Je suis très intéressé par la musique.
熊猫,panda,熊猫喜欢吃竹子。,Les pandas aiment manger du bambou.
休息,se reposer,我们需要休息一下。,Nous avons besoin de nous reposer un peu.
需要,avoir besoin de,我需要买新衣服。,J'ai besoin d'acheter de nouveaux vêtements.
学生,étudiant,他是大学的学生。,Il est étudiant à l'université.
学校,école,这是我的学校。,C'est mon école.
雪,neige,今天下雪了。,Il neige aujourd'hui.
眼睛,yeux,她的眼睛很漂亮。,Ses yeux sont très beaux.
羊肉,mouton,这家餐厅的羊肉很好吃。,Le mouton de ce restaurant est délicieux.
要求,demander,老师要求我们做作业。,Le professeur nous demande de faire nos devoirs.
要,vouloir,我要去商店。,Je veux aller au magasin.
也,aussi,我也喜欢看电影。,J'aime aussi regarder des films.
一,un,我有一本书。,J'ai un livre.
衣服,vêtements,这件衣服很漂亮。,Ce vêtement est très joli.
医生,médecin,这位医生很有经验。,Ce médecin est très expérimenté.
医院,hôpital,医院在街道的右边。,L'hôpital est à droite de la rue.
一定,certainement,我一定会来参加你的生日派对。,Je viendrai certainement à ta fête d'anniversaire.
一共,en tout,这些书一共多少钱？,Combien coûtent ces livres en tout ?
一会儿,un moment,请等一会儿。,"Attendez un moment, s'il vous plaît."
以后,après,以后我想成为老师。,"Plus tard, je veux devenir professeur."
以前,avant,他以前住在巴黎。,"Avant, il habitait à Paris."
椅子,chaise,这把椅子很舒服。,Cette chaise est très confortable.
一般,général,他的法语水平一般。,Son niveau de français est moyen.
一起,ensemble,我们一起去吃饭吧。,Allons manger ensemble.
一直,toujours,他一直很喜欢运动。,Il a toujours aimé le sport.
意思,sens,这个词的意思是什么？,Quel est le sens de ce mot ?
阴,nuageux,今天天气很阴。,"Aujourd'hui, le temps est nuageux."
影响,influence,这件事会影响你的学习。,Cela va influencer tes études.
用,utiliser,我们用中文说话。,Nous parlons en chinois.
游泳,nager,我每周去游泳两次,Je nage deux fois par semaine
有,avoir/il y a,我有一本新书,J'ai un nouveau livre
有名,célèbre,这家餐厅很有名,Ce restaurant est très célèbre
又,encore/de nouveau,他又迟到了,Il est encore en retard
遇到,rencontrer,我在街上遇到了我的老师,J'ai rencontré mon professeur dans la rue
元,yuan,这本书二十元,Ce livre coûte vingt yuans
愿意,vouloir/être prêt à,我愿意帮助你,Je veux t'aider
月,mois/lune,一年有十二个月,Il y a douze mois dans une année
月亮,lune,今晚的月亮很圆,La lune est très ronde ce soir
越,de plus en plus,他跑得越来越快,Il court de plus en plus vite
