chinese_word,french_translation,chinese_sentence,french_sentence
云,dire,古人云：知识就是力量,Les anciens disent : le savoir est la force
在,être à/dans,他在学校,Il est à l'école
再,encore/de nouveau,请再说一遍,"Répétez encore une fois, s'il vous plaît"
早上,matin,早上好！,Bonjour !
怎么,comment/pourquoi,你怎么去学校？,Comment vas-tu à l'école ?
站,station/se tenir debout,请在这里站一下。,Veuillez vous tenir debout ici.
丈夫,mari,我的丈夫在医院工作。,Mon mari travaille à l'hôpital.
着急,s'inquiéter,别着急，我们会找到解决办法。,"Ne t'inquiète pas, nous trouverons une solution."
找,chercher,我在找我的钥匙。,Je cherche mes clés.
照片,photo,这是我家人的照片。,C'est une photo de ma famille.
照相机,appareil photo,我买了一个新的照相机。,J'ai acheté un nouvel appareil photo.
着,en train de,他穿着蓝色衬衫。,Il porte une chemise bleue.
真,vraiment,这个故事真有趣。,Cette histoire est vraiment intéressante.
正在,en train de,她正在做作业。,Elle est en train de faire ses devoirs.
知道,savoir,我知道他住在哪里。,Je sais où il habite.
只,seulement,我只有一本书。,J'ai seulement un livre.
中国,Chine,我想去中国旅游。,Je veux voyager en Chine.
中午,midi,中午我们一起吃饭吧。,Mangeons ensemble à midi.
种,type/planter,这种花很漂亮。,Ce type de fleur est très beau.
重要,important,这是一个重要的决定。,C'est une décision importante.
周末,le week-end,我周末去公园.,Je vais au parc le week-end.
主要,principal,这是主要的问题.,C'est le problème principal.
住,habiter,我住在巴黎.,J'habite à Paris.
祝,souhaiter,祝你生日快乐!,Je te souhaite un joyeux anniversaire!
注意,faire attention,请注意安全.,Faites attention à la sécurité.
桌子,la table,书在桌子上.,Le livre est sur la table.
字,caractère,这个字很难写.,Ce caractère est difficile à écrire.
字典,le dictionnaire,我需要买一本字典.,J'ai besoin d'acheter un dictionnaire.
自己,soi-même,我自己做饭.,Je cuisine moi-même.
走,marcher,我们一起走吧.,Marchons ensemble.
最,le plus,这是最好的.,C'est le meilleur.
最近,récemment,最近天气很好.,Le temps est bon récemment.
昨天,hier,昨天我去了商店.,"Hier, je suis allé au magasin."
坐,s'asseoir,请坐在这里.,"Asseyez-vous ici, s'il vous plaît."
做,faire,我在做作业.,Je fais mes devoirs.
作用,"effet, fonction, rôle",太阳光对植物的生长有重要作用。,La lumière du soleil a un effet important sur la croissance des plantes.
